[I 2026-09-27 01:02:45,454] A new study created in RDB with name: weather_volume
[I 2026-09-27 01:02:46,270] Trial 0 finished with value: 0.8485175753897789 and parameters: {'alpha': 1, 'mode': 'rain', 'residual_strength': 0}. Best is trial 0 with value: 0.8485175753897789.
[I 2026-09-27 01:02:47,076] Trial 1 finished with value: 0.8443344514269611 and parameters: {'alpha': 1, 'mode': 'rain', 'residual_strength': 1}. Best is trial 0 with value: 0.8485175753897789.
[I 2026-09-27 01:02:47,879] Trial 2 finished with value: 0.8106705567011994 and parameters: {'alpha': 10, 'mode': 'climate', 'residual_strength': 0}. Best is trial 0 with value: 0.8485175753897789.
[I 2026-09-27 01:02:48,684] Trial 3 finished with value: 0.8348766362123219 and parameters: {'alpha': 1, 'mode': 'spline', 'residual_strength': 1}. Best is trial 0 with value: 0.8485175753897789.
[I 2026-09-27 01:02:49,479] Trial 4 finished with value: 0.8330934169970485 and parameters: {'alpha': 1, 'mode': 'climate', 'residual_strength': 1}. Best is trial 0 with value: 0.8485175753897789.
[I 2026-09-27 01:02:50,280] Trial 5 finished with value: 0.8147993189285694 and parameters: {'alpha': 100, 'mode': 'rain', 'residual_strength': 1}. Best is trial 0 with value: 0.8485175753897789.
[I 2026-09-27 01:02:51,078] Trial 6 finished with value: 0.7448756955749407 and parameters: {'alpha': 100, 'mode': 'spline', 'residual_strength': 0}. Best is trial 0 with value: 0.8485175753897789.
[I 2026-09-27 01:02:51,876] Trial 7 finished with value: 0.8338548471942056 and parameters: {'alpha': 100, 'mode': 'climate', 'residual_strength': 1}. Best is trial 0 with value: 0.8485175753897789.
[I 2026-09-27 01:02:52,674] Trial 8 finished with value: 0.8374958845877797 and parameters: {'alpha': 10, 'mode': 'spline', 'residual_strength': 1}. Best is trial 0 with value: 0.8485175753897789.
[I 2026-09-27 01:02:53,475] Trial 9 finished with value: 0.7979315350038167 and parameters: {'alpha': 1, 'mode': 'climate', 'residual_strength': 0}. Best is trial 0 with value: 0.8485175753897789.
[I 2026-09-27 01:02:54,275] Trial 10 finished with value: 0.8353839404807184 and parameters: {'alpha': 10, 'mode': 'climate', 'residual_strength': 1}. Best is trial 0 with value: 0.8485175753897789.
[I 2026-09-27 01:02:55,078] Trial 11 finished with value: 0.8342571325021646 and parameters: {'alpha': 100, 'mode': 'spline', 'residual_strength': 1}. Best is trial 0 with value: 0.8485175753897789.
[I 2026-09-27 01:02:55,872] Trial 12 finished with value: 0.802002355122784 and parameters: {'alpha': 1, 'mode': 'spline', 'residual_strength': 0}. Best is trial 0 with value: 0.8485175753897789.
[I 2026-09-27 01:02:56,667] Trial 13 finished with value: 0.7344632709986894 and parameters: {'alpha': 100, 'mode': 'rain', 'residual_strength': 0}. Best is trial 0 with value: 0.8485175753897789.
[I 2026-09-27 01:02:57,466] Trial 14 finished with value: 0.8410560404536624 and parameters: {'alpha': 10, 'mode': 'rain', 'residual_strength': 1}. Best is trial 0 with value: 0.8485175753897789.
[I 2026-09-27 01:02:58,264] Trial 15 finished with value: 0.814014840796527 and parameters: {'alpha': 10, 'mode': 'spline', 'residual_strength': 0}. Best is trial 0 with value: 0.8485175753897789.
[I 2026-09-27 01:02:59,064] Trial 16 finished with value: 0.7448032129584501 and parameters: {'alpha': 100, 'mode': 'climate', 'residual_strength': 0}. Best is trial 0 with value: 0.8485175753897789.
[I 2026-09-27 01:02:59,879] Trial 17 finished with value: 0.8458800497127141 and parameters: {'alpha': 10, 'mode': 'rain', 'residual_strength': 0}. Best is trial 0 with value: 0.8485175753897789.
weather_volume {'alpha': 1, 'mode': 'rain', 'residual_strength': 0} [0.8759695690603748, 0.8210655817191829, 0.8745823889229528, 0.8774798194168585]
