[I 2026-09-27 01:42:18,451] A new study created in RDB with name: climate
[I 2026-09-27 01:42:19,655] Trial 0 finished with value: 0.7779682095882023 and parameters: {'alpha': 100, 'mode': 'climate', 'fit_days': 112}. Best is trial 0 with value: 0.7779682095882023.
[I 2026-09-27 01:42:20,823] Trial 1 finished with value: 0.7816344109496005 and parameters: {'alpha': 100, 'mode': 'spline', 'fit_days': 0}. Best is trial 1 with value: 0.7816344109496005.
[I 2026-09-27 01:42:21,982] Trial 2 finished with value: 0.8129927773119918 and parameters: {'alpha': 1, 'mode': 'climate', 'fit_days': 0}. Best is trial 2 with value: 0.8129927773119918.
[I 2026-09-27 01:42:23,134] Trial 3 finished with value: 0.7810715206452874 and parameters: {'alpha': 100, 'mode': 'climate', 'fit_days': 0}. Best is trial 2 with value: 0.8129927773119918.
[I 2026-09-27 01:42:24,289] Trial 4 finished with value: 0.7991458199528443 and parameters: {'alpha': 10, 'mode': 'spline', 'fit_days': 0}. Best is trial 2 with value: 0.8129927773119918.
[I 2026-09-27 01:42:25,448] Trial 5 finished with value: 0.8088425444606749 and parameters: {'alpha': 1, 'mode': 'climate', 'fit_days': 112}. Best is trial 2 with value: 0.8129927773119918.
[I 2026-09-27 01:42:26,617] Trial 6 finished with value: 0.8149955893696647 and parameters: {'alpha': 1, 'mode': 'spline', 'fit_days': 0}. Best is trial 6 with value: 0.8149955893696647.
[I 2026-09-27 01:42:27,786] Trial 7 finished with value: 0.7775744283443173 and parameters: {'alpha': 100, 'mode': 'spline', 'fit_days': 112}. Best is trial 6 with value: 0.8149955893696647.
[I 2026-09-27 01:42:28,944] Trial 8 finished with value: 0.7951803839634086 and parameters: {'alpha': 10, 'mode': 'climate', 'fit_days': 0}. Best is trial 6 with value: 0.8149955893696647.
[I 2026-09-27 01:42:30,102] Trial 9 finished with value: 0.7899571990220603 and parameters: {'alpha': 10, 'mode': 'spline', 'fit_days': 112}. Best is trial 6 with value: 0.8149955893696647.
[I 2026-09-27 01:42:31,268] Trial 10 finished with value: 0.8068043615041767 and parameters: {'alpha': 1, 'mode': 'spline', 'fit_days': 112}. Best is trial 6 with value: 0.8149955893696647.
[I 2026-09-27 01:42:32,427] Trial 11 finished with value: 0.7908295739650829 and parameters: {'alpha': 10, 'mode': 'climate', 'fit_days': 112}. Best is trial 6 with value: 0.8149955893696647.
climate {'alpha': 1, 'mode': 'spline', 'fit_days': 0} [0.8176473883729417, 0.8123437903663876, 0.8752113690786814, 0.8894308027360025]
