[I 2026-09-27 01:19:59,471] A new study created in RDB with name: operations
[I 2026-09-27 01:20:00,646] Trial 0 finished with value: 0.8574219990858377 and parameters: {'july7': 0.6, 'july50': 1.5, 'route_season': True, 'shape': 'season'}. Best is trial 0 with value: 0.8574219990858377.
[I 2026-09-27 01:20:01,792] Trial 1 finished with value: 0.8613703289733099 and parameters: {'july7': 0.3, 'july50': 1.25, 'route_season': False, 'shape': 'season'}. Best is trial 1 with value: 0.8613703289733099.
[I 2026-09-27 01:20:02,656] Trial 2 finished with value: 0.8583436301149522 and parameters: {'july7': 0.3, 'july50': 1.5, 'route_season': True, 'shape': 'ridge'}. Best is trial 1 with value: 0.8613703289733099.
[I 2026-09-27 01:20:03,519] Trial 3 finished with value: 0.8600992010078936 and parameters: {'july7': 0.45, 'july50': 1.5, 'route_season': True, 'shape': 'ridge'}. Best is trial 1 with value: 0.8613703289733099.
[I 2026-09-27 01:20:04,378] Trial 4 finished with value: 0.8629878717893906 and parameters: {'july7': 0.45, 'july50': 1.25, 'route_season': False, 'shape': 'ridge'}. Best is trial 4 with value: 0.8629878717893906.
[I 2026-09-27 01:20:05,524] Trial 5 finished with value: 0.8601957026074345 and parameters: {'july7': 0.45, 'july50': 1.5, 'route_season': True, 'shape': 'season'}. Best is trial 4 with value: 0.8629878717893906.
[I 2026-09-27 01:20:06,661] Trial 6 finished with value: 0.8602163474695912 and parameters: {'july7': 0.6, 'july50': 1.25, 'route_season': False, 'shape': 'season'}. Best is trial 4 with value: 0.8629878717893906.
[I 2026-09-27 01:20:07,522] Trial 7 finished with value: 0.8612964609611794 and parameters: {'july7': 0.3, 'july50': 1.25, 'route_season': False, 'shape': 'ridge'}. Best is trial 4 with value: 0.8629878717893906.
[I 2026-09-27 01:20:08,383] Trial 8 finished with value: 0.8600007117572377 and parameters: {'july7': 0.6, 'july50': 1.0, 'route_season': False, 'shape': 'ridge'}. Best is trial 4 with value: 0.8629878717893906.
[I 2026-09-27 01:20:09,519] Trial 9 finished with value: 0.8630607927894957 and parameters: {'july7': 0.45, 'july50': 1.25, 'route_season': False, 'shape': 'season'}. Best is trial 9 with value: 0.8630607927894957.
[I 2026-09-27 01:20:10,650] Trial 10 finished with value: 0.8599872179100124 and parameters: {'july7': 0.6, 'july50': 1.0, 'route_season': False, 'shape': 'season'}. Best is trial 9 with value: 0.8630607927894957.
[I 2026-09-27 01:20:11,511] Trial 11 finished with value: 0.8573122393179393 and parameters: {'july7': 0.6, 'july50': 1.5, 'route_season': True, 'shape': 'ridge'}. Best is trial 9 with value: 0.8630607927894957.
[I 2026-09-27 01:20:12,358] Trial 12 finished with value: 0.8611680934811178 and parameters: {'july7': 0.3, 'july50': 1.0, 'route_season': False, 'shape': 'ridge'}. Best is trial 9 with value: 0.8630607927894957.
[I 2026-09-27 01:20:13,218] Trial 13 finished with value: 0.862859504309329 and parameters: {'july7': 0.45, 'july50': 1.0, 'route_season': False, 'shape': 'ridge'}. Best is trial 9 with value: 0.8630607927894957.
[I 2026-09-27 01:20:14,356] Trial 14 finished with value: 0.8602337724908611 and parameters: {'july7': 0.45, 'july50': 1.5, 'route_season': False, 'shape': 'season'}. Best is trial 9 with value: 0.8630607927894957.
[I 2026-09-27 01:20:15,506] Trial 15 finished with value: 0.8605933056063564 and parameters: {'july7': 0.3, 'july50': 1.25, 'route_season': True, 'shape': 'season'}. Best is trial 9 with value: 0.8630607927894957.
[I 2026-09-27 01:20:16,654] Trial 16 finished with value: 0.862349397355912 and parameters: {'july7': 0.45, 'july50': 1.25, 'route_season': True, 'shape': 'season'}. Best is trial 9 with value: 0.8630607927894957.
[I 2026-09-27 01:20:17,791] Trial 17 finished with value: 0.8628316632299169 and parameters: {'july7': 0.45, 'july50': 1.0, 'route_season': False, 'shape': 'season'}. Best is trial 9 with value: 0.8630607927894957.
[I 2026-09-27 01:20:18,936] Trial 18 finished with value: 0.8585841722435774 and parameters: {'july7': 0.6, 'july50': 1.0, 'route_season': True, 'shape': 'season'}. Best is trial 9 with value: 0.8630607927894957.
[I 2026-09-27 01:20:20,086] Trial 19 finished with value: 0.8611411994137311 and parameters: {'july7': 0.3, 'july50': 1.0, 'route_season': False, 'shape': 'season'}. Best is trial 9 with value: 0.8630607927894957.
[I 2026-09-27 01:20:20,947] Trial 20 finished with value: 0.8584295714562697 and parameters: {'july7': 0.3, 'july50': 1.5, 'route_season': False, 'shape': 'ridge'}. Best is trial 9 with value: 0.8630607927894957.
[I 2026-09-27 01:20:21,812] Trial 21 finished with value: 0.8596284413299989 and parameters: {'july7': 0.3, 'july50': 1.0, 'route_season': True, 'shape': 'ridge'}. Best is trial 9 with value: 0.8630607927894957.
[I 2026-09-27 01:20:22,955] Trial 22 finished with value: 0.8573893271709567 and parameters: {'july7': 0.6, 'july50': 1.5, 'route_season': False, 'shape': 'season'}. Best is trial 9 with value: 0.8630607927894957.
[I 2026-09-27 01:20:24,100] Trial 23 finished with value: 0.8596017840156187 and parameters: {'july7': 0.3, 'july50': 1.0, 'route_season': True, 'shape': 'season'}. Best is trial 9 with value: 0.8630607927894957.
[I 2026-09-27 01:20:24,954] Trial 24 finished with value: 0.8572621897323897 and parameters: {'july7': 0.6, 'july50': 1.5, 'route_season': False, 'shape': 'ridge'}. Best is trial 9 with value: 0.8630607927894957.
[I 2026-09-27 01:20:26,101] Trial 25 finished with value: 0.8595756938343151 and parameters: {'july7': 0.6, 'july50': 1.25, 'route_season': True, 'shape': 'season'}. Best is trial 9 with value: 0.8630607927894957.
[I 2026-09-27 01:20:27,245] Trial 26 finished with value: 0.8584396108578791 and parameters: {'july7': 0.3, 'july50': 1.5, 'route_season': True, 'shape': 'season'}. Best is trial 9 with value: 0.8630607927894957.
[I 2026-09-27 01:20:28,115] Trial 27 finished with value: 0.8585970505329861 and parameters: {'july7': 0.6, 'july50': 1.0, 'route_season': True, 'shape': 'ridge'}. Best is trial 9 with value: 0.8630607927894957.
[I 2026-09-27 01:20:28,974] Trial 28 finished with value: 0.8595541482365955 and parameters: {'july7': 0.6, 'july50': 1.25, 'route_season': True, 'shape': 'ridge'}. Best is trial 9 with value: 0.8630607927894957.
[I 2026-09-27 01:20:29,844] Trial 29 finished with value: 0.8623411099265499 and parameters: {'july7': 0.45, 'july50': 1.25, 'route_season': True, 'shape': 'ridge'}. Best is trial 9 with value: 0.8630607927894957.
[I 2026-09-27 01:20:30,985] Trial 30 finished with value: 0.8585433086746754 and parameters: {'july7': 0.3, 'july50': 1.5, 'route_season': False, 'shape': 'season'}. Best is trial 9 with value: 0.8630607927894957.
[I 2026-09-27 01:20:31,863] Trial 31 finished with value: 0.8613840122229404 and parameters: {'july7': 0.45, 'july50': 1.0, 'route_season': True, 'shape': 'ridge'}. Best is trial 9 with value: 0.8630607927894957.
[I 2026-09-27 01:20:32,732] Trial 32 finished with value: 0.8601290792372993 and parameters: {'july7': 0.6, 'july50': 1.25, 'route_season': False, 'shape': 'ridge'}. Best is trial 9 with value: 0.8630607927894957.
[I 2026-09-27 01:20:33,885] Trial 33 finished with value: 0.8613578757651741 and parameters: {'july7': 0.45, 'july50': 1.0, 'route_season': True, 'shape': 'season'}. Best is trial 9 with value: 0.8630607927894957.
[I 2026-09-27 01:20:34,754] Trial 34 finished with value: 0.8605855390336083 and parameters: {'july7': 0.3, 'july50': 1.25, 'route_season': True, 'shape': 'ridge'}. Best is trial 9 with value: 0.8630607927894957.
[I 2026-09-27 01:20:35,617] Trial 35 finished with value: 0.860120982284481 and parameters: {'july7': 0.45, 'july50': 1.5, 'route_season': False, 'shape': 'ridge'}. Best is trial 9 with value: 0.8630607927894957.
operations {'july7': 0.45, 'july50': 1.25, 'route_season': False, 'shape': 'season'} [0.87785554565751, 0.8482660399214813, 0.8889675988638828, 0.9051670665827483]
